{
  "$schema": "https://json-schema.org/draft/2020-12/schema",
  "title": "Design Plugin — per-repo config",
  "description": "Per-repo configuration consumed by the design plugin's dev-server, slash commands, and skills. Place at <repo>/.design/config.json.",
  "type": "object",
  "additionalProperties": false,
  "required": ["name", "designRoot"],
  "properties": {
    "name": {
      "type": "string",
      "description": "Short repo / product name. Shown in server header and as a token in skill prompts."
    },
    "projectLabel": {
      "type": "string",
      "description": "Long label for the design browser (window title and big H1). Defaults to <name> + ' Design'."
    },
    "designRoot": {
      "type": "string",
      "description": "Repo-relative root where canvas + design system files live. Default convention: '.design' (top-level, alongside .git, .claude, etc.). Older repos may use '.ai/design'.",
      "default": ".design"
    },
    "canvasGroups": {
      "type": "array",
      "description": "Top-level groupings shown in the file tree. Each entry maps a folder under designRoot to a sidebar section.",
      "items": {
        "type": "object",
        "required": ["label", "path"],
        "properties": {
          "label": { "type": "string" },
          "path": {
            "type": "string",
            "description": "Folder under designRoot to scan for .html canvases."
          }
        },
        "additionalProperties": false
      },
      "default": [
        { "label": "Design system", "path": "system" },
        { "label": "Canvases", "path": "ui" }
      ]
    },
    "rootClass": {
      "type": "string",
      "description": "Body / canvas root CSS class that the project's tokens are scoped under. Generated canvases use <body class=\"<rootClass>\">.",
      "default": "app"
    },
    "themeDefault": {
      "type": "string",
      "enum": ["dark", "light"],
      "description": "Default theme attribute (data-theme) for new canvases.",
      "default": "dark"
    },
    "tokensCssRel": {
      "type": "string",
      "description": "Project-wide tokens CSS path, relative to designRoot. Used as the fallback when 'designSystems' is unset OR when an entry omits its own 'tokensCssRel'. New canvases <link> to this file by default. Per DDR-048, per-DS entries auto-resolve to '<designSystems[i].path>/colors_and_type.css' when their own field is missing.",
      "default": "system/colors_and_type.css"
    },
    "teamAccentDefault": {
      "type": ["string", "null"],
      "description": "Optional default value for data-team attribute on new canvases. Set to null if the project doesn't use multi-team accent overrides."
    },
    "handoffTargets": {
      "type": "array",
      "description": "Where /design:handoff emits target artifacts. Empty array disables handoff. Special `path` values: `registry:item` emits a shadcn registry-item.json sidecar next to the canvas (Phase 3.6 default — consume via `bunx shadcn add file://./<Slug>.registry.json`). Any other path is treated as a repo-relative target dir for legacy direct-migration handoff. Recommended single-entry default: `[{ label: 'shadcn registry', path: 'registry:item', platform: 'web' }]`.",
      "items": {
        "type": "object",
        "required": ["label", "path"],
        "properties": {
          "label": { "type": "string" },
          "path": {
            "type": "string",
            "description": "`registry:item` for shadcn sidecar emit, or repo-relative target dir for direct migration."
          },
          "platform": { "type": "string", "enum": ["web", "mobile", "desktop", "other"] }
        },
        "additionalProperties": false
      },
      "default": []
    },
    "newCanvasDir": {
      "type": "string",
      "description": "Default folder (under designRoot) where /design:new scaffolds new canvas .tsx files (Phase 3.6+; older repos may still hold .html canvases pending one-shot migration).",
      "default": "ui"
    },
    "newComponentDir": {
      "type": "string",
      "description": "Default folder (under designRoot) where /design:new puts shared component .jsx files.",
      "default": "ui/components"
    },
    "extensions": {
      "type": "array",
      "description": "User-added directories the docs renderer / completeness-critic should track but not validate against the standard schema. Each entry maps a folder (under the DS) to a label.",
      "items": {
        "type": "object",
        "required": ["label", "path"],
        "properties": {
          "label": { "type": "string" },
          "path": { "type": "string" }
        },
        "additionalProperties": false
      },
      "default": []
    },
    "completenessProfile": {
      "type": "string",
      "enum": ["minimal", "standard", "strict"],
      "description": "Severity profile for the design-system-completeness-critic. 'minimal' = Core blockers only; 'standard' = Core + most Conventional checks; 'strict' = all checks incl. voice/tone/hard-stops in README.",
      "default": "standard"
    },
    "activeFamilies": {
      "type": "array",
      "description": "Token families this project has in scope. Computed during /design:setup-ds. The completeness-critic uses this to gate Conventional checks (e.g. type-mono specimen only required when 'mono' is here).",
      "items": {
        "type": "string",
        "enum": ["accent", "status", "presence", "mono"]
      },
      "default": ["accent"]
    },
    "accentStrategy": {
      "type": "string",
      "description": "How many --accent* families exist. The completeness-critic C7 gates the actual family count against this declaration. Default: 'single' (backwards-compatible). 'chromatic-N' is parameterized — write the literal N (e.g. 'chromatic-5'). Per DDR-043.",
      "pattern": "^(single|paired|chromatic-[1-9][0-9]?)$",
      "default": "single"
    },
    "colorSpace": {
      "type": "string",
      "enum": ["oklch", "hsl", "hex", "lab"],
      "description": "Color space the project uses in tokens CSS. The completeness-critic V2 gates the actual token format against this declaration. Default: 'oklch' (backwards-compatible). Per DDR-043.",
      "default": "oklch"
    },
    "designSystems": {
      "type": "array",
      "description": "Design systems available in this project. Single-DS projects have one entry; multi-DS projects (marketing vs. admin vs. mobile) list each here. Each canvas's .meta.json declares which DS it uses via the 'designSystem' field. The System view's DS picker iterates this array.",
      "items": {
        "type": "object",
        "required": ["name", "path"],
        "properties": {
          "name": {
            "type": "string",
            "pattern": "^[a-z][a-z0-9-]*$",
            "description": "Kebab-case slug. Used to match canvas .meta.json.designSystem references and as the ?ds=<name> query param on /_system-data."
          },
          "path": {
            "type": "string",
            "description": "Folder under designRoot (e.g. 'system/marketing'). The DS-scoped System view reads tokens, previews, and ui_kits from inside this folder."
          },
          "description": { "type": "string" },
          "tokensCssRel": {
            "type": "string",
            "description": "Per-DS tokens CSS path, relative to designRoot. When omitted, auto-resolves to '<path>/colors_and_type.css' (DDR-048). Set explicitly when the DS's tokens live under a non-standard filename."
          },
          "rootClass": {
            "type": "string",
            "description": "Optional root class applied to canvases in this DS (overrides the project-wide rootClass for this DS's previews + new canvases)."
          },
          "themeDefault": {
            "type": "string",
            "enum": ["dark", "light"],
            "description": "Per-DS theme default. Overrides the project-wide themeDefault when rendering this DS's specimens."
          },
          "themes": {
            "type": "array",
            "items": { "type": "string" },
            "description": "Optional list of theme names this DS supports (used by the System view's theme toggle when more than one theme is declared)."
          },
          "newCanvasDir": {
            "type": "string",
            "description": "Override of the project-wide newCanvasDir for canvases scaffolded inside this DS."
          },
          "newComponentDir": {
            "type": "string",
            "description": "Override of the project-wide newComponentDir for components scaffolded inside this DS."
          }
        },
        "additionalProperties": false
      },
      "default": []
    },
    "defaultDesignSystem": {
      "type": ["string", "null"],
      "description": "Name of the DS used when a canvas's .meta.json has no 'designSystem' field. For single-DS projects, this is the only DS. For multi-DS, pick the most common.",
      "default": null
    },
    "linkedHub": {
      "type": "object",
      "description": "Pairs this repo with a Maude hub for cross-machine file sync (Phase 9 Task 3+4). Written by 'maude design link <url> --token <hex>'. Token NEVER lives in this committed config — it's stored per-machine in ~/.config/maude/hubs.json. When present, 'maude design serve' starts the bidirectional Yjs↔fs sync agent (Task 4).",
      "required": ["url", "linkedAt"],
      "properties": {
        "url": {
          "type": "string",
          "description": "Hub base URL (normalized — trailing slash trimmed, scheme + host lowercased). The sync agent constructs ws(s)://<host> from this for the HocuspocusProvider connection."
        },
        "linkedAt": {
          "type": "number",
          "description": "Unix-ms timestamp from when 'maude design link' was first run on this repo."
        },
        "adopt": {
          "type": "boolean",
          "description": "When true, the first sync after boot pushes local disk state up to the hub unconditionally (use case: bootstrapping the hub from a populated repo, or hub-was-wiped recovery). Cleared after first successful adopt."
        }
      },
      "additionalProperties": false
    }
  }
}
